{
  "version": "1.0",
  "targeted_system_display_maximum_luminance": 1000,
  "targeted_system_display_actual_peak_luminance_flag": true,
  "num_bezier_curve_anchors": 10,
  "knee_point_x": 0.5,
  "knee_point_y": 0.5,
  "bezier_curve_anchors": [
    {
      "x": 0.0,
      "y": 0.01
    },
    {
      "x": 0.1,
      "y": 0.08000000000000002
    },
    {
      "x": 0.2,
      "y": 0.16000000000000003
    },
    {
      "x": 0.30000000000000004,
      "y": 0.24000000000000005
    },
    {
      "x": 0.4,
      "y": 0.316
    },
    {
      "x": 0.5,
      "y": 0.5
    },
    {
      "x": 0.65,
      "y": 0.65
    },
    {
      "x": 0.8,
      "y": 0.8
    },
    {
      "x": 0.95,
      "y": 0.95
    },
    {
      "x": 0.975,
      "y": 0.975
    }
  ],
  "mastering_display_actual_peak_luminance_flag": true,
  "max_content_light_level": 162,
  "max_frame_average_light_level": 144,
  "scene_or_frame": [
    {
      "targeted_system_display_maximum_luminance": 178,
      "targeted_system_display_actual_peak_luminance_flag": true,
      "num_bezier_curve_anchors": 10,
      "knee_point_x": 0.25,
      "knee_point_y": 0.35,
      "bezier_curve_anchors": [
        {
          "x": 0.0,
          "y": 0.01
        },
        {
          "x": 0.1,
          "y": 0.08000000000000002
        },
        {
          "x": 0.2,
          "y": 0.16000000000000003
        },
        {
          "x": 0.30000000000000004,
          "y": 0.24000000000000005
        },
        {
          "x": 0.4,
          "y": 0.3236
        },
        {
          "x": 0.5,
          "y": 0.55
        },
        {
          "x": 0.65,
          "y": 0.7150000000000001
        },
        {
          "x": 0.8,
          "y": 0.8800000000000001
        },
        {
          "x": 0.95,
          "y": 1.0
        },
        {
          "x": 0.975,
          "y": 1.0
        }
      ],
      "luminance_distribution": {
        "percentile_10": 0.0,
        "percentile_25": 0.0,
        "percentile_50": 8.0,
        "percentile_75": 17.0,
        "percentile_90": 80.0,
        "percentile_95": 127.42158534540688,
        "percentile_99": 144.0,
        "percentile_99.9": 144.0
      }
    }
  ]
}