{
  "version": "1.0",
  "targeted_system_display_maximum_luminance": 1000,
  "targeted_system_display_actual_peak_luminance_flag": true,
  "num_bezier_curve_anchors": 10,
  "knee_point_x": 0.5,
  "knee_point_y": 0.5,
  "bezier_curve_anchors": [
    {
      "x": 0.0,
      "y": 0.01
    },
    {
      "x": 0.1,
      "y": 0.08000000000000002
    },
    {
      "x": 0.2,
      "y": 0.16000000000000003
    },
    {
      "x": 0.30000000000000004,
      "y": 0.24000000000000005
    },
    {
      "x": 0.4,
      "y": 0.316
    },
    {
      "x": 0.5,
      "y": 0.5
    },
    {
      "x": 0.65,
      "y": 0.65
    },
    {
      "x": 0.8,
      "y": 0.8
    },
    {
      "x": 0.95,
      "y": 0.95
    },
    {
      "x": 0.975,
      "y": 0.975
    }
  ],
  "mastering_display_actual_peak_luminance_flag": true,
  "max_content_light_level": 1000,
  "max_frame_average_light_level": 400,
  "scene_or_frame": []
}